sentence,sentence_id,cue_span,scope_span,target
Expression of Neur in dorsal cells was sufficient to compensate for the loss of D-mib activity (D).,PMC1064853,NaN,NaN,0
"However, given the low 30% identity between the RAG1 and sea urchin/lancelet/sea squirt RAG1-like proteins, we cannot exclude the possibility that the ancestral RAG2 protein went through a period of strong diversification driven by positive selection, and it can no longer be identified by sequence comparisons but may still be present in invertebrates.",PMC1131882/X6.267.2,"[(263, 272)]","[263, 310]",1
The final likelihood ratio is then the product of the preliminary score calculated in panel A and the likelihood ratio output by the transitive module in panel B.,1471-2105-8-239,NaN,NaN,0
Anti-D-mib antibodies were generated that specifically detected D-mib on Western blots (see Figure 1C) and on fixed tissues (Figure 3F–F?).,PMC1064853,NaN,NaN,0
This parameter was determined empirically.,1471-2105-8-239,NaN,NaN,0
"In Drosophila, dosage compensation is achieved in the heterogametic male by a twofold chromosome-wide up-regulation (hypertranscription) of essentially all genes on the single X chromosome.",PMC138894,NaN,NaN,0
Eligible iORFs were then clustered using BLASTCLUST with score density 0.5 and minimum length coverage 0.6.,1471-2105-8-225,NaN,NaN,0
"To do this, all protein pairs were considered that achieve an estimated posterior odds ratio > 1 when the EOCT predictor was trained on the full datasets without cross-validation.",1471-2105-8-239/X2.209.1,"[(154, 161)]","[154, 178]",1
Columns 1 and 2 list common and Latin names of species whose genomes contain Transib TPase sequences.,PMC1131882,NaN,NaN,0
"Therefore, adenosine signaling through the AdoR must play a role in the developmental arrest of the adgf-a mutant, and this is most likely mediated by signaling to the ring gland, where AdoR is expressed (ED, unpublished data).",PMC1135298,NaN,NaN,0
This conclusion is further supported by the even more efficient rescue achieved by expression of transgenically provided ADGF-A in the lymph glands using the Gal4/UAS system (see below).,PMC1135298,NaN,NaN,0
"These domains are related to essential cellular functions, suggesting that many domain interactions were already present in the last universal common ancestor.",1471-2105-8-259,NaN,NaN,0
"Some methods predict interaction from sequence-motifs found to be over-represented in interacting protein pairs 19, or by considering the physico-chemical properties and the location of groups of amino acids in the sequence 2021.",1471-2105-8-239,NaN,NaN,0
"The activity of the neur gene is also required for lateral inhibition during neurogenesis in embryos and pupae [4,45,61].",PMC1064853,NaN,NaN,0
"Therefore, yet another possibility is that they are a highly conserved operon.",1471-2105-8-225,NaN,NaN,0
This could be due to the fact that the number of non-interacting protein pairs outweighs greatly the number of interacting protein pairs in cells.,1471-2105-8-239,NaN,NaN,0
Every motif finder they tested was found to be sensitive to values used for these parameters.,1471-2105-8-249,NaN,NaN,0
"The most likely explanation is that the 23rd amino acid does not exist, or its distribution on the tree of life is rather limited.",1471-2105-8-225/X1.232.1,"[(61, 64)]","[61, 70]",1
The rate of mitochondrial release of cytochrome c in mammalian cells undergoing apoptosis was recently measured and found to be rapid [18].,PMC138857,NaN,NaN,0
Detailed explanation is given in the text.,1471-2105-8-225,NaN,NaN,0
"The y-axis shows the percentage of the pupae (blue bars) and adult flies (purple bars) demonstrating the larval and pupal survival, respectively.",PMC1135298,NaN,NaN,0
"As suggested in 18, by making more such datasets available, it will be possible to increase our coverage of the interaction space and determine the most likely human interactions.",1471-2105-8-239,NaN,NaN,0
"For instance, the small size of the Reaper protein - only of 65 amino acids - makes it extremely difficult to identify homologs on the basis of genomic sequence information in other species: current gene-finding programs typically require an open reading frame of at least 70 amino acids.",PMC138857,NaN,NaN,0
"Similarly, but in a much more pronounced way, the Disorder module is only slightly predictive of interaction, with a maximum likelihood ratio of 1.8.",1471-2105-8-239,NaN,NaN,0
"Indigenous properties of the Transib TPase, that were not related directly to RAG1 functions, including those responsible for the precise 5-bp length of TSDs, might have been altered during evolution of RAG1, leading to occasional 4-bp and 3-bp TSDs that are atypical for Transib transposons.",PMC1131882/X6.149.1,"[(54, 57)]","[54, 157]",1
"If we enumerate all iORFs from microbial genomes, most of the readthrough genes will be included in them.",1471-2105-8-225,NaN,NaN,0
Training and testing was performed with 5-fold cross-validation.,1471-2105-8-239,NaN,NaN,0
Homology search against unfinished microbial genomes identified seven homologous proteins from four other δ-proteobacteria species.,1471-2105-8-225,NaN,NaN,0
"To discriminate them from true readthrough genes, evolutionary information was exploited.",1471-2105-8-225,NaN,NaN,0
Motif model abbreviations: cons = consensus; PWM = position weight matrix; mis = consensus with predefined number of allowed non-position-specific mismatches.,1471-2105-8-249,NaN,NaN,0
"Here, we investigate how the domain interactions from the iPfam database are distributed in protein interactions taken from the HPRD, MPact, BioGRID, DIP and IntAct databases.",1471-2105-8-259,NaN,NaN,0
"The mutation in AdoR does not block macrophage differentiation and fat-body disintegration, so this effect must involve another, as yet uncharacterized mechanism independent of AdoR signaling.",PMC1135298/X7.260.2,"[(26, 29)]","[26, 90]",1
VTI1A is a trans-Golgi-network-localized putative t-SNARE 59 and VAMP3 is an early/recycling endosomal v-SNARE 60.,1471-2105-8-239,NaN,NaN,0
"In addition to this combinatorial diversity, further diversity is generated by small insertions and deletions at junctions between the joined segments.",PMC1131882,NaN,NaN,0
"This is practically indispensable for objective classification of candidates, but there is no guarantee that unknown proteins with the 23rd amino acid will score higher than the thresholds.",1471-2105-8-225,NaN,NaN,0
"This confirms that Ser signaling requires the activity of the D-mib gene, i.e., that D-mib acts downstream of Ser.",PMC1064853,NaN,NaN,0
"At least, only one experimentally-confirmed example from a pathogenic strain of Escherichia coli 23, whose genome is not yet determined, does not obey this rule.",1471-2105-8-225/X1.255.1,"[(142, 145)]","[142, 160]",1
The low coverage and variable quality of the experimental interaction datasets have prompted many groups to investigate computational methods to predict interactions or to determine the most likely interactions seen in the high-throughput datasets.,1471-2105-8-239,NaN,NaN,0
RAG1 aa whose replacements resulted in previously detected defects of V(D)J recombination [31] are marked by color rectangles indicated below the alignment blocks; red indicates DNA binding defect; green indicates nicking defect; cyan indicates hairpin defect; blue indicates joining mutants; yellow indicates catalytic mutants; gray indicates joining/transposition.,PMC1131882,NaN,NaN,0
"In this study, the mutation described as adgf-akarel was used in all experiments and is referred to here as adgf-a.",PMC1135298,NaN,NaN,0
"Along with the progress of genome sequencing projects, computational prediction methods of selenocysteine-containing proteins (selenoproteins) have been developed by several research groups 78910, and the repertoire of selenoproteins has been greatly expanded 1112.",1471-2105-8-225,NaN,NaN,0
"If so, then both N-terminal and core domains of RAG1 might have been derived from different genes present in a common ancestor of Deuterostomes.",PMC1131882,NaN,NaN,0
Expression data were downloaded from the Gene Expression Omnibus 70.,1471-2105-8-239,NaN,NaN,0
"While there is no structural information about putative interactions between these pairs, this fraction can already be analysed using statistical methods to identify putative domain interactions 7910.",1471-2105-8-259/X4.196.1,"[(15, 17)]","[15, 88]",1
The y-axis shows the percentage of larvae with tumors out of all larvae of each genotype examined for (A).,PMC1135298,NaN,NaN,0
Cell-to-cell signaling mediated by receptors of the Notch (N) family has been implicated in various developmental decisions in organisms ranging from nematodes to mammals [1].,PMC1064853,NaN,NaN,0
"Next, iORFs that overlap RNA genes or protein-coding genes in different reading frames were discarded.",1471-2105-8-225,NaN,NaN,0
The y-axis shows the percentage of puparia out of all collected third-instar larvae (three vials each with 30 animals; the standard error is shown).,PMC1135298,NaN,NaN,0
The myc tag was added to the C terminus of the ADGF-A protein for detection by anti-c-Myc antibody (Sigma-Aldrich).,PMC1135298,NaN,NaN,0
"Boxes denote iORFs, and × indicates the inframe stop codon.",1471-2105-8-225,NaN,NaN,0
Tissue losses were associated with a dramatic reduction in size of the eye field and of the wing pouch in mutant discs of third instar larvae (Figure 2A–2E).,PMC1064853,NaN,NaN,0
"In such cases, it is likely that a voting-based ensemble will follow the crowd and fail to find the true binding site.",1471-2105-8-249,NaN,NaN,0
"We find, however, that iPfam domain pairs occur significantly more often in experimental interactions than would be expected by chance.",1471-2105-8-259,NaN,NaN,0
"Recently, the cat eye syndrome critical region protein 1 (CECR1) gene was identified and shown to encode a protein representing a subfamily of proteins related to but distinct from classical ADAs [9].",PMC1135298,NaN,NaN,0
SCOPE's accuracy on this dataset was remarkably stable in the presence of extraneous sequences.,1471-2105-8-249,NaN,NaN,0
"Similarly, the co-occurrence of PTMs is also predictive of interaction, with its highest scoring bin obtaining a likelihood ratio of 6 as shown in Figure 3B.",1471-2105-8-239,NaN,NaN,0
"These results suggest that SCOPE's learning rule is highly effective, though it may certainly be improved further.",1471-2105-8-249,NaN,NaN,0
Randomised protein interaction networks with identical degree distributions were generated from the original filtered experimental interaction data for each species.,1471-2105-8-259,NaN,NaN,0
Crystal cells were visualized by heating larvae at 60 °C for 10 min in a water bath [46].,PMC1135298,NaN,NaN,0
"This is most likely due to the fact that the localization-derived negative trained predictor cannot take full advantage of the Transitive module, since the network resulting from the predictions of the Group A modules likely does not sample the whole protein pair space well.",1471-2105-8-239/X2.204.3,"[(93, 99)]","[93, 144]",1
"Although the two proteins are only 38% identical to each other, they share common features: (1) their N-terminal portions are missing and the RAG1-like sequences start at positions 17 or 18; (2) in both proteins the first aa residue overlaps with the acceptor splice site; and (3) their similarity to RAG1 starts at positions corresponding to position 470 of the human RAG1.",PMC1131882/X6.170.1,"[(126, 133)]","[96, 133]",1
Hemocytes also differentiate and are released from the lymph glands during systemic infection [19].,PMC1135298,NaN,NaN,0
"This is not surprising as the transfer of interacting orthologs (known as interologs 33) from one organism to another is a popular method to predict interactions (see for example 3448), particularly in the case of organisms like human for which only a small proportion of interactions are known.",1471-2105-8-239/X2.106.1,"[(8, 11)]","[8, 22]",1
"Conversely, some likelihood ratios would be underestimated for protein pairs achieving simultaneously low likelihoods for non-independent features.",1471-2105-8-239,NaN,NaN,0
It is well known that the genetic code varies in several organisms 22.,1471-2105-8-225,NaN,NaN,0
"SCOPE has no user-adjustable parameters, although its component algorithms do contain a number of internal parameters ""(""hyperparameters"")"" that govern their search over common nuisance parameters.",1471-2105-8-249/X3.170.1,"[(10, 12)]","[10, 39]",1
"From the 294 binary protein interactions in this data set, 24 contained an iPfam domain pair, which corresponds to a coverage of 8.16% (P value 2.7 · 10-47).",1471-2105-8-259,NaN,NaN,0
We next studied the subcellular localization of D-mib (Figure 3).,PMC1064853,NaN,NaN,0
This is not surprising as previous studies have indicated that quite stringent joint E-values must be used to transfer interactions safely between organisms 3435.,1471-2105-8-239/X2.108.2,"[(8, 11)]","[8, 22]",1
"The first column lists all 18 Transib TPases used as queries in our analysis, and the shaded areas indicate those added to the original set of all GenBank proteins in subsequent PSI-BLAST searches.",PMC1131882,NaN,NaN,0
The product of their likelihood ratios is referred to as the Preliminary Score.,1471-2105-8-239,NaN,NaN,0
The D-mib1 mutation corresponds to the EY97600 P-element insertion generated by the Gene Disruption Project (http://flypush.imgen.bcm.tmc.edu/pscreen/).,PMC1064853,NaN,NaN,0
The p-value reported for the paired t-test was Bonferroni-corrected to account for multiple (three) comparisons.,1471-2105-8-249,NaN,NaN,0
"We estimated false positive rates for each of the datasets by comparing them two by two to one of the reference datasets, thus generating 4 to 6 different estimates of false positive rates for each computational dataset, as shown in Figure 6A (the two Lehner datasets were not compared to each other, which is why they have fewer FPR estimates).",1471-2105-8-239/X2.263.1,"[(273, 276)]","[243, 299]",1
Bioinformatics analysis of unusual tRNA genes and codon usage may provide insights into this problem.,1471-2105-8-225,NaN,NaN,0
Our predictions lie almost an order of magnitude higher than the 10000 domain interaction types proposed by Aloy and Russel 2.,1471-2105-8-259,NaN,NaN,0
"Although Diablo/Smac shares no sequence homology with Reaper, Hid, or Grim, it too can bind IAPs, preventing them from inhibiting caspase activation, and thereby inducing apoptosis.",PMC138857/X8.73.1,"[(28, 30)]","[28, 74]",1
"This model has received additional support through observations of similar biochemical reactions in transposition and V(D)J recombination [10,11].",PMC1131882,NaN,NaN,0
We then examined D-mib subcellular distribution in epithelial cells located along the edge of the wing discs because cross-sectional imaging affords better resolution along the apical-basal axis.,PMC1064853,NaN,NaN,0
"The Dot-Gal411C on Chromosome II, which shows weak expression [24], did not rescue the phenotype, but a Dot-Gal443A insertion on Chromosome X, which shows stronger expression, rescued approximately half of the mutant animals (Figure 2).",PMC1135298/X7.117.1,"[(72, 75)]","[72, 96]",1
"The central domain of the RAG1 core (residues 531–763) includes two aspartic acid residues from the DDE triad and is also thought to be involved in binding to the RSS heptamer and RAG2 [30,31].",PMC1131882,NaN,NaN,0
"We present a detailed analysis of the hematopoietic defects associated with the adgf-a mutation, show a genetic interaction of this mutation with signaling through the Drosophila adenosine receptor (AdoR, encoded by the gene CG9753) and with regulation of premetamorphic changes by ecdysone, as well as a genetic interaction of ADGF-A with a major innate immunity regulator—the Toll signaling pathway.",PMC1135298,NaN,NaN,0
"As shown in Figure 4A, all modules contribute positively (i.e. contribute a likelihood ratio greater than 1.0) to the prediction of a certain proportion of the interactions in the LR400 dataset.",1471-2105-8-239,NaN,NaN,0
"Such observations are common in many machine learning applications, and are the direct result of complex search spaces that force restrictions on either the search strategy or the representation of the solution space (in this case, the motif model used to represent the motifs).",1471-2105-8-249,NaN,NaN,0
"E: Expression module, O: Orthology module, C: Combined module, T: Transitive module.",1471-2105-8-239,NaN,NaN,0
An iORF was discarded if there were any BLAST hits that do not cover the inframe stop codon.,1471-2105-8-225/X1.102.1,"[(59, 62)]","[59, 91]",1
"For all 33 regulons in the SCPD dataset, we added randomly selected upstream S. cerevisiae sequences such that the total number of extraneous sequences was between 0.5 and 4 times the number of true upstream sequences in the regulon.",1471-2105-8-249,NaN,NaN,0
"If the modules were not independent, some likelihood ratios would likely be overestimated, particularly for protein pairs that achieve simultaneously high likelihoods for non-independent features.",1471-2105-8-239/X2.140.3,"[(20, 23)]","[20, 35]",1
"In addition to the core pathway, several essential regulators have been characterized in Drosophila.",PMC138857,NaN,NaN,0
The Group A modules (shown in panel A) are trained in parallel.,1471-2105-8-239,NaN,NaN,0
"At the same time, sequences homologous to their terminal portions, including specific TIRs, are usually abundant due to the proliferation of nonautonomous DNA transposons fueled by the TPase expressed by the corresponding low-copy autonomous elements.",PMC1131882,NaN,NaN,0
"One well known example is TBP (TATA-binding protein), which localizes the RNA polymerase complex by binding the TATA-box motif roughly 25 bases upstream of the transcription start site 30.",1471-2105-8-249,NaN,NaN,0
"On the basis of current data, it seems that CED-4 functions to help activate the caspase CED-3, and CED-9 blocks this activation through physical interaction with CED-4.",PMC138857,NaN,NaN,0
This makes it difficult to assess whether some domain pairs act as reusable modules in protein interactions from PDB data alone.,1471-2105-8-259,NaN,NaN,0
Both copies appear to be encoded by pseudogenes damaged by a stop codon at the same position of each protein.,PMC1131882,NaN,NaN,0
The Combined module provides positive evidence for the highest number of interactions of the LR400 dataset.,1471-2105-8-239,NaN,NaN,0
Subcellular localization has been extensively used both to assess the quality of interaction datasets 115051 and to generate examples of non-interacting protein pairs to use as negative datasets when training and testing predictors 3746.,1471-2105-8-239,NaN,NaN,0
"Furthermore, methods for assessing the quality of high-throughput experimental results are in high demand due to the error prone nature of the methods used.",1471-2105-8-259,NaN,NaN,0
"This raises an interesting question:: """"Is there a 23rd amino acid""?"".",1471-2105-8-225,NaN,NaN,0
"They consider the physical location of genes, as well as their pattern of occurrence and evolutionary rate, to predict interactions or functional relationships between protein pairs.",1471-2105-8-239,NaN,NaN,0
"As the scores of the predictors increase, so do the number of interactions predicted above different posterior odds ratio thresholds (see lower portion of Table 3).",1471-2105-8-239,NaN,NaN,0
"As more Group A modules are considered within the same predictor, the ROCn AUC scores increase significantly, as would be expected since these features are independent (as shown in Table 2) and thus contribute different information to the prediction.",1471-2105-8-239,NaN,NaN,0
"It is assumed that Xist RNA provides a mark for specific histones (for example, histone macroH2A1.2), as well as proteins deacetylating histones and methylating many of the X-linked genes at GpC dinucleotides [9,10,11]; all these events are important for maintaining the silenced state of the inactivated X.",PMC138894,NaN,NaN,0
"Lethality was reverted by precise excision of the P-element, suggesting that insertion of this P-element is a D-mib mutation, referred to as D-mib1.",PMC1064853,NaN,NaN,0
The z-section axes are shown with a double-headed arrow in (A) and (D).,PMC1064853,NaN,NaN,0
Note that sequence conservation near the selenocysteine is comparable to that of the N-terminal cytochrome domain.,1471-2105-8-225,NaN,NaN,0
"Thus, certain organisms may use one of the sense codons for the novel amino acid.",1471-2105-8-225,NaN,NaN,0
"MLE might be removed in vitro (for example, by elevated ionic strength) without destroying the entire complex, because of the stabilizing presence of MOF-MSL3.",PMC138894/X9.64.1,"[(72, 79)]","[72, 109]",1
Dl and Ser co-localized both at the apical cortex and in large intracellular vesicles in wild-type cells (Figure 4A–4C?).,PMC1064853,NaN,NaN,0
"Nearly all rescued individuals were males, suggesting that expression of the Gal4 driver was influenced by X-chromosome dosage compensation, and expression in females heterozygous for Dot-Gal4 was not strong enough for rescue.",PMC1135298/X7.118.1,"[(197, 200)]","[184, 225]",1
"Our result suggests that the unknown amino acid encoded by stop codons does not exist, or its phylogenetic distribution is rather limited, which is in agreement with the previous study on tRNA.",1471-2105-8-225/X1.15.1,"[(76, 79)]","[76, 85]",1
Figure 1 illustrates the training scheme and architecture of the method.,1471-2105-8-239,NaN,NaN,0
"The lack of specificity might be attributed to a number of reasons, such as the absence of other MSL components, the presence of other RNAs interacting with MOF, or worse, it might reflect a property of MOF without functional significance: that is, MOF might not contact RNA at all in vivo.",PMC138894/X9.72.3,"[(207, 214)]","[207, 238]",1
"In some cases, the inserted amino acid is not one of the 20 amino acids but a noncanonical one.",1471-2105-8-225/X1.19.1,"[(42, 45)]","[42, 71]",1
Open reading frames are shown in black.,PMC1064853,NaN,NaN,0
"In contrast to the first cluster, no homolog was identified from other species.",1471-2105-8-225/X1.174.1,"[(34, 36)]","[34, 78]",1
This resulted in 26896 distinct human protein interactions involving 7531 distinct human proteins present in the initial IPI dataset.,1471-2105-8-239,NaN,NaN,0
"Similarly, none of SCOPE's component algorithms outperformed the other ten programs on this dataset by a statistically significant margin.",1471-2105-8-249/X3.187.1,"[(11, 15)]","[11, 137]",1
"Furthermore, our study of this mutant provides strong evidence that the fat body disintegration is promoted by the action of hemocytes.",PMC1135298,NaN,NaN,0
"Nuisance parameters are parameters that cannot be precisely defined without knowledge of the true binding sites (such as motif length, number of occurrences and orientation).",1471-2105-8-249/X3.167.1,"[(68, 75)]","[68, 173]",1
"From these sites, they then reach into the neighboring chromatin regions by yet another mechanism.",PMC138894,NaN,NaN,0
"The best combination of Group A modules is the predictor consisting of the Expression, Orthology and Combined modules.",1471-2105-8-239,NaN,NaN,0
Interactions were predicted above a TP/FP ratio (number of true positives divided by the number of false positives in the test set) of 1.,1471-2105-8-239,NaN,NaN,0
"The Transitive module enhances the prediction by identifying among protein pairs with a relatively high preliminary score those that are most likely to interact, by considering the local topology of the network around them.",1471-2105-8-239,NaN,NaN,0
Dimethylamine methyltransferases also lack non-readthrough homologs.,1471-2105-8-225/X1.220.1,"[(38, 42)]","[38, 67]",1
"The use of a PSSM in place of a fixed generic substitution matrix such as BLOSUM62 results in a much more sensitive BLAST search [18,45].",PMC1131882,NaN,NaN,0
"For each protein, we calculate the degree, defined as the number of interactions the protein is involved in.",1471-2105-8-259,NaN,NaN,0
Transib transpositions are expected to be catalyzed by the binding of the TPase to TIRs of autonomous and nonautonomous transposons [17].,PMC1131882,NaN,NaN,0
The numbers of the PSI-BLAST iterations after which the entire RAG1 core significantly aligned with the TPases are indicated in parentheses.,PMC1131882,NaN,NaN,0
"Here we show that the hemocytes (blood cells) are the main regulator of adenosine in the Drosophila larva, as was speculated previously for mammals.",PMC1135298,NaN,NaN,0
"Thus, the transitive module takes as input the product of the likelihood ratios of all other modules considered by the predictor (as illustrated in Figure 1B).",1471-2105-8-239,NaN,NaN,0
"However, as the posterior odds ratio decreases, the overlap between the predictions and the HPRD-derived training set decreases.",1471-2105-8-239,NaN,NaN,0
(B) Non-gapped alignment of consensus sequences of 5? TIRs from 21 families of Transib transposons.,PMC1131882,NaN,NaN,0
The result of the above homology searches was also used for the boundary analysis (Figure 1b).,1471-2105-8-225,NaN,NaN,0
The predicted total number of iPfam domain pairs in species S,1471-2105-8-259,NaN,NaN,0
"Conversely, the activity of the neur gene is essential for binary cell-fate decisions in the bristle lineage [22] that do not require the activity of the D-mib gene (no bristle defects were seen in D-mib mutant flies).",PMC1064853/X5.275.1,"[(165, 168)]","[165, 217]",1
This deletion represents a null allele of D-mib and was named D-mib2.,PMC1064853,NaN,NaN,0
Multiple alignment of these protein sequences is reported in Figure S5.,PMC1131882,NaN,NaN,0
