sentence,sentence_id,cue_span,scope_span,target
"Figure 7 shows the aggregate results of this test, with the SCPD regulons divided into three groups based on SCOPE's accuracy on the true regulon.",1471-2105-8-249,NaN,NaN,0
"For the Orthology module: YL, YM, YH: yeast low, medium and high scoring bins; FL, FM, FH: fly low, medium and high scoring bins; WL, WM, WH: worm low, medium and high scoring bins; HM and HL: medium and low scoring bins for human protein pairs that have human paralogs; > 1 organism: bin for human protein pairs that have interologs in more than one organism.",1471-2105-8-239,NaN,NaN,0
"Based on this information, the function of these motifs in Transib TPases is expected to be similar to that in RAG1.",PMC1131882,NaN,NaN,0
"Even prior to the discovery of RAG1 and RAG2, it had been suggested that the first two RSSs were originally terminal inverted repeats (TIRs) of an ancient transposon whose accidental insertion into a gene ancestral to BCR and TCR, followed by gene duplications, triggered the emergence of the V(D)J machinery [4].",PMC1131882,NaN,NaN,0
"Images were acquired on a Leica (Wetzlar, Germany) SP2 microscope and assembled using Adobe Photoshop (Adobe Systems, San Jose, California, United States).",PMC1064853,NaN,NaN,0
The role of the roX genes and roX RNAs in this process is still unclear.,PMC138894,NaN,NaN,0
"Note that, however, if the whole length of an iORF was used as a query sequence, this procedure will erroneously discard multidomain readthrough proteins.",1471-2105-8-225,NaN,NaN,0
"Whereas a background set of promoter regions is easy to identify, it is not clear how to define a reasonable genomic sample of enhancers.",1471-2105-8-249,NaN,NaN,0
"This shows that the block of the putative interaction between fat body and macrophage-like cells (which are still present in double mutants) suppresses the fat body disintegration, further strengthening the hypothesis that the disintegration is caused by hemocytes.",PMC1135298,NaN,NaN,0
"The main source of developmental hormones in the Drosophila larva is the ring gland, composed of the prothoracic gland, corpus allatum, and corpus cardiacum [28].",PMC1135298,NaN,NaN,0
"This is why we describe interactions as a relationship between two proteins, allowing for a more precise description of the interaction.",1471-2105-8-239,NaN,NaN,0
We tested whether iPfam domain pairs are enriched in known protein complexes from S. cerevisiae.,1471-2105-8-259,NaN,NaN,0
The Gal4/UAS [18] system was used for protein misexpression.,PMC1135298,NaN,NaN,0
"This protein was suggested to be a scavenger receptor, but it does not seem to be homologous to Drosophila Croquemort (unpublished data).",PMC1135298/X7.239.1,"[(67, 70)]","[59, 117]",1
"Similar results were also obtained in D-mib2 mutant clones, which showed strongly elevated levels of cortical Ser (Figure 4H) whereas the amount of Dl at the apical cortex was not detectably modified (see Figures 3F–3F?? and 4J).",PMC1064853/X5.167.1,"[(176, 179)]","[134, 199]",1
"The complete loss of D-mib activity in D-mib1 wing discs did not significantly change the internalization of anti-Dl antibodies (Figure 5D''??, 5E''??, and 5F??)'', indicating that D-mib is not required for Dl endocytosis in this tissue.",PMC1064853/X5.193.1,"[(190, 193)]","[181, 236]",1
One constraint associated with such an approach is the run-time.,1471-2105-8-249,NaN,NaN,0
Multiple alignments of distantly related RAG1 and Transib TPase protein sequences were created by T-Coffee [40].,PMC1131882,NaN,NaN,0
"We then plotted Sig versus accuracy for each objective function, to determine which objective functions correlated most strongly with biological relevance (Figure 2).",1471-2105-8-249,NaN,NaN,0
A similar regulatory role has also been attributed to blood cells in humans [5].,PMC1135298,NaN,NaN,0
The expectation λ is most accurately modeled using Maximum Likelihood Estimators (MLEs) computed as the actual proportion of any given motif in the complete set of all upstream sequences in the genome 10.,1471-2105-8-249,NaN,NaN,0
"In another study [13], six of six TSDs detected in the intermolecular transposition were 5 bp long.",PMC1131882,NaN,NaN,0
"For example, in Caenorhabditis elegans, dosage compensation occurs in the homogametic hermaphrodite (XX) by the down-regulation of virtually all genes on the two X chromosomes by about 50%.",PMC138894,NaN,NaN,0
The accuracy reported is the average measured for all combinations of training and testing sets using these five sets.,1471-2105-8-239,NaN,NaN,0
This highlights a basic assumption of this study that could be a source of error.,1471-2105-8-259,NaN,NaN,0
"SCOPE was run on 78 regulons from S. cerevisiae, B. subtilis, E. coli and D. melanogaster.",1471-2105-8-249,NaN,NaN,0
The second problem is that adjacent genes on the same reading frame may satisfy the condition of conserved iORFs.,1471-2105-8-225,NaN,NaN,0
"Therefore, even if only 30% of the sea urchin genome has been sequenced to date, it is expected that the regions flanking the TPase portions of potential autonomous elements should be similar to numerous nonautonomous elements.",PMC1131882,NaN,NaN,0
"In addition to these diverse approaches, some groups have combined concepts from several of the above categories in integrative frameworks.",1471-2105-8-239,NaN,NaN,0
"However, a narrowing of the Cut-positive margin was observed (Figure 6D), suggesting that D-mib contributes to regulating the level of Dl signaling.",PMC1064853,NaN,NaN,0
"In scoring a motif m, a choice must therefore be made as to whether or not the reverse complement mR of m will be considered to be the same motif as m.",1471-2105-8-249,NaN,NaN,0
"In this study, we focus on theoretical ORFs with one inframe stop codon, termed ""interrupted ORFs"" (iORFs) (Figure 1a).",1471-2105-8-225,NaN,NaN,0
This suggested that there is insufficient data currently available to determine a reliable ratio for human.,1471-2105-8-239,NaN,NaN,0
This cluster is probably an artifact of close phylogenetic relationship.,1471-2105-8-225,NaN,NaN,0
Drosophila Neur is a 754-amino-acid protein that contains two conserved Neur homology repeats of unknown function and one C-terminal catalytic really interesting new gene (RING) domain.,PMC1064853,NaN,NaN,0
"A simple modification to the overrepresentation objective function is coverage, which is identical to overrepresentation with the modification that C(m) is the number of upstream regions in the regulon that have one or more instances of m and λ, the expectation of C(m), is determined from the proportion of upstream regions in the genome that contain the motif.",1471-2105-8-249,NaN,NaN,0
The functional differences observed between D-mib and neur cannot be simply explained by obvious differences in molecular activity and/or substrate specificity.,PMC1064853/X5.280.1,"[(59, 65)]","[0, 159]",1
"CED-9 has mammalian counterparts in the anti-apoptotic subgroup of Bcl-2 family members, while EGL-1 has mammalian counterparts in the pro-apoptotic subgroup.",PMC138857,NaN,NaN,0
"Localization studies of MSL proteins in male nuclei carrying autosomal roX1 or roX2 transgenes showed that the roX genes or RNAs recruit the entire set of MSL proteins to their transgenic location and can lead locally to acetylation of histone H4 [1,14].",PMC138894,NaN,NaN,0
This is because our method is limited to readthrough genes conserved across two or more species.,1471-2105-8-225,NaN,NaN,0
"To test whether the correlation is an artefact of the distribution of the values, we recalculated the correlation 1000 times, each time shuffling one distribution randomly.",1471-2105-8-259,NaN,NaN,0
BEAM and SPACER thus enumerate and evaluate all motifs with both values of this flag.,1471-2105-8-249,NaN,NaN,0
"Given the predominance of 5-bp TSDs, it is striking that Transib transposons belong to the only superfamily of eukaryotic DNA transposons with 5-bp TSDs generated upon insertions into the genome [17,24].",PMC1131882,NaN,NaN,0
"These MLEs are implemented as lookups of exact substrings, which can be performed efficiently using a suffix array data structure 101112.",1471-2105-8-249,NaN,NaN,0
Previous studies have demonstrated that some of the features considered here are indeed independent 43.,1471-2105-8-239,NaN,NaN,0
"MLE appears to be the next protein to join the growing DCC as it is found at reduced levels at some of these 35 sites when the remaining two proteins, MSL3 and MOF, are absent [16].",PMC138894,NaN,NaN,0
(A) Frequencies of the most frequent nucleotides at each position of the consensus sequence of the 5? TIRs of transposons that belong to 20 families of Transib transposons identified in fruit flies and mosquitoes.,PMC1131882,NaN,NaN,0
"Remarkably, the acceptor splice site positions in the sea urchin RAG1 core–like proteins closely correspond to those in RAG1 from teleosts (i.e., most of the living ray-finned or bony fish), in which RAG1 is split by an intron at position homologous to Gly460 in human RAG1 [34].",PMC1131882,NaN,NaN,0
"There is no apparent need for cytochrome c release in C. elegans, since CED-4 does not require it to activate CED-3.",PMC138857/X8.45.2,"[(9, 11)]","[9, 64]",1
"We thus chose to run SCOPE using the overrepresentation-KS combined objective function on the S. cerevisiae dataset, in which the upstream regions are of fixed length.",1471-2105-8-249,NaN,NaN,0
"Any performance comparison must be interpreted with caution, since the results are highly dependent on the dataset used, the conditions of the testing and the metrics used for evaluation.",1471-2105-8-249,NaN,NaN,0
Disorder module,1471-2105-8-239,NaN,NaN,0
"Furthermore, given that the sea urchin, lancelet, hydra, and starlet sea anemone genomes harbor several highly divergent N-terminal–like domains, separate from the RAG1 core–like sequences and known transposable elements, it is very likely that the N-terminal–like domains of RAG1 also form a multigene family that can be traced back to a common ancestor of Deuterostomes (see Figure 1).",PMC1131882,NaN,NaN,0
"The results show that introducing the adoR mutation into the adgf-a background significantly increases pupariation, as well as adult emerging rate, compared to the adgf-a single mutant (Figure 6B).",PMC1135298,NaN,NaN,0
"For instance, Dl (but not Ser) is essential for lateral inhibition during early neurogenesis in the embryo [4].",PMC1064853/X5.19.1,"[(22, 25)]","[22, 30]",1
"Consistent with this interpretation, Dl and Ser have been proposed to act redundantly in the sensory bristle lineage where they are co-expressed ([11]; note, however, that results from another study have indicated a non-redundant function for Dl in the bristle lineage [12]).",PMC1064853,NaN,NaN,0
"In (A), Ser is in red and Discs-large (Dlg) is in blue.",PMC1064853,NaN,NaN,0
"Evidence from co-immunoprecipitation experiments indicates that MSL1 and MSL2 interact directly with each other, a notion supported by the MSL1-MSL2 association at the 35 chromosomal entry sites in the absence of any other MSLs (the preDCC; Figure 1).",PMC138894,NaN,NaN,0
"However, the gene is probably a pseudogene because it contains an inframe TAA codon in addition to the TAG codon, and only one species seems to have the amber-containing form of the gene.",1471-2105-8-225,NaN,NaN,0
"These findings indicate that roX2 might be incorporated into this partial DCC complex in an MLE-dependent manner and that roX1 RNA is incorporated at a later stage, together with MSL3 and perhaps MOF.",PMC138894,NaN,NaN,0
Presumably the elevated adenosine in the adgf-a mutant blocks the production or release of ecdysone from the ring gland by an unknown mechanism.,PMC1135298,NaN,NaN,0
"Pyrrolysine, the 22nd amino acid encoded by stop codon UAG, was recently discovered from a methanogenic archaea 56.",1471-2105-8-225,NaN,NaN,0
The Combined module for these predictors only considers domains and PTMs but not subcellular localization as this would result in using this feature both in the selection of the training set and as a feature predictive of interaction.,1471-2105-8-239/X2.202.2,"[(77, 80)]","[77, 105]",1
The formula we apply is x^S=χS⋅ΘSθS⋅ΨSψS,1471-2105-8-259,NaN,NaN,0
This recognition does not require any of the known roX RNAs.,PMC138894/X9.60.1,"[(22, 25)]","[22, 59]",1
The set of interactions predicted in this work increases the coverage of the human interaction map and will help determine the highest confidence human interactions.,1471-2105-8-239,NaN,NaN,0
"Selection of the correct settings for these parameters is a crucial step in motif finding, and is often assumed to be the domain of experts.",1471-2105-8-249,NaN,NaN,0
"The founding member of this subfamily is encoded by insect-derived growth factor(IDGF) [10], and homologs have been described in various organisms [11–14].",PMC1135298,NaN,NaN,0
"If they are true selenoproteins, this protein family becomes a rare instance of selenoprotein that lacks non-selenocysteine homologs.",1471-2105-8-225/X1.169.1,"[(99, 104)]","[99, 132]",1
Basic ideas of the prediction method.,1471-2105-8-225,NaN,NaN,0
"Third instar larvae wing discs were dissected in Schneider's Drosophila medium (Gibco BRL, San Diego, California, United States) containing 10% fetal calf serum (Gibco BRL).",PMC1064853,NaN,NaN,0
(B) Survival rate of double mutants compared to single adgf-a mutant.,PMC1135298,NaN,NaN,0
"This conclusion is consistent with observations made earlier showing that secreted versions of Ser cannot activate N but instead antagonize Ser signaling [56,57].",PMC1064853/X5.267.1,"[(99, 105)]","[99, 116]",1
"To avoid this problem, a partial sequence around the inframe stop codon was used as a query.",1471-2105-8-225,NaN,NaN,0
The N-terminal domain of RAG1 has long been viewed as distinct from the core domain due to its lack of direct involvement in the V(D)J recombination reaction.,PMC1131882/X6.249.1,"[(95, 99)]","[95, 157]",1
"Columns 4–6 report the Ei-values for best matches between RAG1s and a Transib-derived PSSM after adding 7, 13, and 18 Transib TPases to the GenBank set, respectively.",PMC1131882,NaN,NaN,0
Yet another example is glycine reductase selenoprotein A.,1471-2105-8-225,NaN,NaN,0
"Mutant larvae were raised on plates with yeast paste at 25 °C and transferred to vials with glucose-yeast medium (control) or with glucose-yeast medium containing 20-hydroxyecdysone (H-5142; Sigma-Aldrich, St.",PMC1135298,NaN,NaN,0
"Even between a prokaryote like E. coli and the two eukaryotes S. cerevisiae and H. sapiens there is a considerable proportion of conserved iPfam domain pairs, to the extent that 53% of the iPfam domain pairs from E. coli are also observed in a eukaryote (Table 2).",1471-2105-8-259,NaN,NaN,0
"Three pairs of recently duplicated sequences (nucleotide identity is higher than 95%) are underlined by red, green, and black lines, respectively.",PMC1131882,NaN,NaN,0
Posterior part of late third-instar wild-type larva (H).,PMC1135298,NaN,NaN,0
"Thus, despite their obvious structural differences, Neur and D-mib appear to act similarly to promote the endocytosis of Dl and Ser.",PMC1064853,NaN,NaN,0
"As a result, the RAG1 core is split into separate exons at the aa position that corresponds to position 460 in the human RAG1gene [29,34,38].",PMC1131882,NaN,NaN,0
"Transgenic flies carrying HS-ADGF-A,UAS-ADGF-Amyc, and UAS-mutADGF-Amyc construct (see description below) were produced by a modified P-element transformation method [45].",PMC1135298,NaN,NaN,0
"It should be noted however that in the PDB structures, some of the observed domain pairs (Pkinase_Tyr ↔ SH3_1, Pkinase_C ↔ Pkinase and others) are only seen to interact within one protein (intrachain interactions) as opposed to interactions between two distinct proteins (interchain interaction).",1471-2105-8-259,NaN,NaN,0
"Again, it is unclear if this part is not present in sea urchins or simply undetectable due to its small size and the high sequence divergence.",PMC1131882/X6.260.1,"[(37, 40)]","[37, 86]",1
We also compared the iPfam domain pair frequencies between H. sapiens and S. cerevisiae directly.,1471-2105-8-259,NaN,NaN,0
"The prothoracic gland releases the steroid molting hormone ecdysone, which is converted to an active form, 20-hydroxyecdysone (20E), by the fat body as well as some of the target organs [29].",PMC1135298,NaN,NaN,0
"Although many of these novel predictions have not been previously investigated in the literature, there exists experimental evidence supporting a subset of these predictions which is not present in the June 2006 version of the HPRD used to train our predictor, thus providing independent validation of our method.",1471-2105-8-239/X2.298.1,"[(183, 186)]","[183, 259]",1
"To provide a basis for evaluating the performance of SCOPE's learning rule, we constructed an ensemble learning method (referred to here as BASELINE) from the results of BEAM, PRISM and SPACER, by randomly selecting one of the accuracies from these three programs for each regulon.",1471-2105-8-249,NaN,NaN,0
It is possible that more power could be gained by identifying other distinct motif classes and adding algorithms that explicitly search for those classes.,1471-2105-8-249,NaN,NaN,0
"Autonomous DNA transposons from the MuDR, Harbinger, and En/Spm superfamilies are each known to encode a second regulatory protein [23,24], whereas some transposons from these superfamilies encode the TPase only.",PMC1131882,NaN,NaN,0
Dl and Ser were also detected in large intracellular vesicles that probably correspond to multivesicular bodies in that they also stained for hepatocyte growth factor-regulated tyrosine kinase substrate [46] (Figure 3B–3C'''???; data not shown).,PMC1064853,NaN,NaN,0
"Although the specificity of these interactions remains to be investigated, the findings of Akthar and coworkers [2] provide a new possible role for chromodomains involved in RNA binding.",PMC138894,NaN,NaN,0
"The first problem is that even if an iORF has homologs in other species, it could be a pseudogene or a product of sequencing error.",1471-2105-8-225,NaN,NaN,0
The probability of the observed match between the RSS and Transib termini to occur by chance is less than 10-3 (see Materials and Methods).,PMC1131882,NaN,NaN,0
"Moreover, it does not assume the occurrence of non-readthrough homologs in the public databases.",1471-2105-8-225/X1.266.1,"[(18, 21)]","[18, 95]",1
"To examine the contribution of the different modules, we plotted the number of interactions predicted among all LR400 interactions (all interactions predicted using the full predictor that obtain a likelihood ratio of interaction greater than 400) as a function of the minimum likelihood ratio of individual modules (in panel A) or of combinations of modules (in panel B).",1471-2105-8-239,NaN,NaN,0
This conclusion is consistent with the existence of a putative binding site for Dorsal (one of two known effectors of Toll signaling) in the ADGF-A promoter (Figure 9).,PMC1135298,NaN,NaN,0
The second and third filtering processes remove such genes based on BLAST alignment patterns.,1471-2105-8-225,NaN,NaN,0
"The first 305-aa protein is encoded by contig 1226, and its recently duplicated copies are on contigs 1219 and 1222 (approximately 95% identical to each other at the protein level).",PMC1131882,NaN,NaN,0
Ratios greater than 100 were not considered because they are computationally infeasible given the size of our datasets and the architecture of the predictor.,1471-2105-8-239/X2.181.1,"[(29, 32)]","[0, 43]",1
The HLK ensemble method 4 successfully exploits the first key observation above.,1471-2105-8-249,NaN,NaN,0
Species distribution of iPfam domain pairs.,1471-2105-8-259,NaN,NaN,0
"The 390,926 iORFs were translated into amino acid sequences and subjected to TBLASTN 16 against the 191 genome sequences.",1471-2105-8-225,NaN,NaN,0
"These females hypertranscribe their two X chromosomes and therefore die during development, but they can be rescued if any other msl mutation is present.",PMC138894,NaN,NaN,0
"We have shown that the D-mib gene regulates wing margin formation, leg segmentation, and vein formation, whereas none of these three processes depend on neur gene activity ([45,60]; this study).",PMC1064853/X5.274.1,"[(113, 117)]","[113, 171]",1
"These features were originally investigated separately, as shown in Figure 3, but their combination into one module that considers all dependencies between them achieves higher accuracy (data not shown) and higher likelihood ratios (as can be seen by comparing to Figure 1) while still being computationally feasible.",1471-2105-8-239/X2.112.1,"[(192, 195)]","[186, 202]",1
Let X be the sample that we wish to compare to some reference sample Y.,1471-2105-8-249,NaN,NaN,0
Black circles denote conserved residues that form the RAG1/Transib catalytic DDE triad.,PMC1131882,NaN,NaN,0
We conclude that the mutation has additional effects on the hormonal regulation of development.,PMC1135298,NaN,NaN,0
"In contrast to normal larval plasmatocytes, which remain rounded after settling down on the substrate (Figure 4A), most of the cells in the adgf-a mutant (more than 75%) are strongly adhesive and, after they are deposited in a drop of hemolymph on a microscope slide, develop filamentous and membranous extensions (Figure 4B–4D).",PMC1135298,NaN,NaN,0
"For each species, we list the size of the proteome as defined in Integr8 and the fraction of this proteome that is represented in the protein interaction sets, followed by the total number of binary protein interactions and the fraction of those that contain an iPfam domain pair.",1471-2105-8-259,NaN,NaN,0
"Homozygous pupae usually die soon after pupariation; in some cases they develop normal head and thorax imaginal structures; however, abdominal parts usually do not develop.",PMC1135298/X7.45.1,"[(160, 163)]","[160, 171]",1
These highest scoring predictions receive high likelihood ratios of interaction from all four predictive modules and represent the strongest examples of interaction as evaluated by our predictor.,1471-2105-8-239,NaN,NaN,0
"Consequently, each gene on the single active X chromosome in female cells and the corresponding gene on the single X chromosome in male cells are expressed at equal levels.",PMC138894,NaN,NaN,0
"Taken as a whole, this further underlines that solving structures of protein complexes should be an important focus for future structural genomics projects.",1471-2105-8-259,NaN,NaN,0
"Furthermore, the effects of multiple testing may bias the results in favor of one of the component algorithms.",1471-2105-8-249,NaN,NaN,0
Multiple sequence alignments of novel candidate proteins.,1471-2105-8-225,NaN,NaN,0
"When protein pairs contained more than one domain pair, the domain pair assigned to the highest Chi-square score bin was used to assign a likelihood of interaction.",1471-2105-8-239,NaN,NaN,0
"To test this hypothesis, we examined whether the forced ubiquitous expression of the neur gene can suppress the D-mib loss-of-function phenotype.",PMC1064853,NaN,NaN,0
(E–E??) D-mib (green in [E and E?]) co-localized with Dl (red in [E and E??]) at the apical cortex of wing pouch cells.,PMC1064853,NaN,NaN,0
"Expression of ADGF-A in salivary glands and fat body (as well as in other tissues) is not required for full rescue, as demonstrated by use of the Cg-Gal4,Dot-Gal4, but especially by e33C-Gal4 driver, and is also not sufficient to rescue the phenotype at all, as demonstrated by T110-Gal4 and Lsp2-Gal4 (Table 1).",PMC1135298/X7.119.2,"[(86, 89)]","[0, 114]",1
"Cg-Gal4 is expressed only in certain compartments of lymph gland lobes containing relatively mature hemocytes, and strongly in most circulating hemocytes [22, 23].",PMC1135298,NaN,NaN,0
These predictions provide a likelihood of interaction for over 260 million human protein pairs and lead to the prediction of over 37000 human interactions.,1471-2105-8-239,NaN,NaN,0
The core components of the cell death pathway are illustrated in Figure 1.,PMC138857,NaN,NaN,0
"The curve representing the full predictor (consisting of the Expression, Orthology, Combined and Transitive modules) is also represented in Figure 4B (the dark green squares).",1471-2105-8-239,NaN,NaN,0
1 ?l of hemolymph was diluted in 99 ?l of buffer.,PMC1135298,NaN,NaN,0
"In this study, iPfam version 21 was employed, containing 2837 iPfam domains, forming 4030 iPfam domain pairs.",1471-2105-8-259,NaN,NaN,0
"Similarly, melanotic tumor formation is significantly suppressed by l(3)hem1, with only 55% of double mutants showing melanotic tumors compared to more than 83% in adgf-a (Figure 6A).",PMC1135298,NaN,NaN,0
"When homozygous, the mutation causes abnormal hemocyte development, leading to melanotic tumor formation [36], as well as fat-body disintegration associated with death during the larval stage or delayed transition to the pupal stage of development.",PMC1135298,NaN,NaN,0
The final likelihood ratio output by the predictor is only representative of the true likelihood of interaction of a protein pair if the modules considered are independent.,1471-2105-8-239,NaN,NaN,0
"However, based on PSI-BLAST searches, no significant similarities between these nine TPases and RAG1 protein were found (data not shown).",PMC1131882/X6.114.2,"[(38, 40)]","[38, 119]",1
We call an iPfam domain pair conserved when the same pair is observed in experimental interactions of two different species.,1471-2105-8-259,NaN,NaN,0
"This family - with at least 19 members, divided into pro- and anti-apoptotic subgroups - has been largely defined by protein-protein interactions among its members (reviewed in [17]).",PMC138857,NaN,NaN,0
The x-axis is shared with (A) (described above).,PMC1135298,NaN,NaN,0
