sentence,sentence_id,cue_span,scope_span,target
"This topology feature greatly enhanced the predictions and together with the full-Bayes combined features, made the largest contribution to the predictions.",1471-2105-8-239,NaN,NaN,0
"The specific role of the chromodomain is unknown, but chromodomain swapping experiments in Drosophila suggest that they might be protein interaction modules [18].",PMC138894,NaN,NaN,0
"Similarly, iORFs were compared with RNA genes using BLASTN, and those matched with the RNAs were removed.",1471-2105-8-225,NaN,NaN,0
All such interacting domain pairs are stored in a database together with detailed information on the residues involved 13.,1471-2105-8-259,NaN,NaN,0
"Indeed, we found that SCOPE increased accuracy by 31–44% over BEAM, PRISM or SPACER alone.",1471-2105-8-249,NaN,NaN,0
"The orthology module has four additional bins: two bin for human pairs that have interacting paralogs in human (a medium and a low confidence bin which use the same definition as above for the model organisms), one bin for human pairs that have interacting homologs in more than one organism (these can be orthologs in yeast, worm or fly, or paralogs in human) and one bin for human pairs that have only non-interacting orthologs.",1471-2105-8-239,NaN,NaN,0
"There is no clear evidence for cytochrome c release during apoptosis in C. elegans or Drosophila, however.",PMC138857,NaN,NaN,0
Flow diagram for SCOPE.,1471-2105-8-249,NaN,NaN,0
"Adenosine could serve as a signal for macrophage differentiation, and the lack of adenosine deaminase activity due to the adgf-a mutation could cause precocious differentiation of these cells in mutant larvae.",PMC1135298/X7.245.2,"[(74, 78)]","[74, 110]",1
"Unlike reaper and grim, hid appears to be regulated not only transcriptionally but also post-translationally by the Ras-MAP kinase pathway [28,29].",PMC138857,NaN,NaN,0
"To avoid background noise introduced by mutations, Transib relics, whose TPase-coding regions contained numerous stop codons and indels, were ignored unless several copies were available.",PMC1131882,NaN,NaN,0
"Based on this observation, each iORF was required to have:: (i) at least one homolog from other organisms that covers the inframe stop codon and (ii) no homolog that does not cover the stop codon.",1471-2105-8-225/X1.76.2,"[(150, 152)]","[150, 195]",1
"To perform such a comparison, the EOCT predictor (Expression, Orthology, Combined and Transitive modules) was trained on datasets consisting of either equal numbers of positives and negatives or 100 times more negatives than positives and then tested on both types of datasets.",1471-2105-8-239,NaN,NaN,0
Manual inspection of these 273 clusters revealed that they still contain many false positives that are unrelated to stop-codon-encoded amino acids.,1471-2105-8-225,NaN,NaN,0
"Ubiquitin is a 76-amino-acid polypeptide that is covalently linked to substrates in a multi-step process that involves a ubiquitin-activating enzyme (E1), a ubiquitin-conjugating enzyme (E2), and a ubiquitin–protein ligase (E3).",PMC1064853,NaN,NaN,0
Transposable and repetitive elements detected in the flanking regions are marked by painted rectangles.,PMC1131882,NaN,NaN,0
Every pair of Pfam families that are found to interact in a PDB structure are called an iPfam domain pair throughout the text.,1471-2105-8-259,NaN,NaN,0
"To do this, all possible combinations of the 4 localization bins, 5 chi-square domain-co-occurrence bins and 4 PTM_score bins were investigated and are referred to as the combined module.",1471-2105-8-239,NaN,NaN,0
"1) Predictors based on sequence and structure exploit the observation that some pairs of sequence motifs, domains and structural families tend to interact preferentially.",1471-2105-8-239,NaN,NaN,0
"In V(D)J recombination, DNA cleavage is catalyzed by two proteins encoded by the recombination-activating genes, approximately 1040-amino acid (aa) RAG1 and approximately 530-aa RAG2 [2,3].",PMC1131882,NaN,NaN,0
"Similarly, interacting proteins are also often involved in similar cellular processes, so Gene Ontology ""process"" and ""function"" annotations have been exploited to predict interactions and validate high-throughput datasets 163638.",1471-2105-8-239,NaN,NaN,0
"For example, ""GSU2293 + downstream"" means that the iORF consists of the gene GSU2293 and its downstream sequence.",1471-2105-8-225,NaN,NaN,0
Mean and standard deviations of the randomisation experiments are shown in Table 1.,1471-2105-8-259,NaN,NaN,0
The 6-mers were randomly sampled from both the upstream regions and the known binding sites to ensure coverage or a wide range of accuracy.,1471-2105-8-249,NaN,NaN,0
"Therefore, it is in principle possible that an ancient vertebrate Transib that was a direct ancestor of the RAG1 core also encoded a second protein, the direct ancestor of RAG2.",PMC1131882,NaN,NaN,0
"In this paper, the prediction of physical interactions between human proteins has been investigated by integrating in a Bayesian framework several different pieces of evidence including orthology, functional features and local network topology.",1471-2105-8-239,NaN,NaN,0
"Furthermore, Dl signaling appears to require the activity of either Neur or D-mib, depending on the developmental contexts.",PMC1064853,NaN,NaN,0
"Endogenous CED-4 is normally localized to the mitochondria by CED-9, unless EGL-1 is expressed [12,13].",PMC138857,NaN,NaN,0
"A similar rescue was observed with a YFP::D-mib protein (Figure 7B–7B?)â€ť, indicating that YFP::D-mib is functional.",PMC1064853,NaN,NaN,0
Table 3 summarizes the characteristics of 19 different predictors and shows accuracy measures.,1471-2105-8-239,NaN,NaN,0
Multiple sequence alignments of novel candidate proteins,1471-2105-8-225,NaN,NaN,0
"Ti, tibia; t1 to t5, tarsal segments 1 to 5.",PMC1064853,NaN,NaN,0
(C and C?) Western blot analysis of D-mib (C).,PMC1064853,NaN,NaN,0
The relatively low iPfam coverage is by itself a disappointing finding.,1471-2105-8-259,NaN,NaN,0
Many pairs of domains co-occur in proteins known to interact.,1471-2105-8-239,NaN,NaN,0
"We find that for proteins from a degree of 1 to 50, there is strong correlation in both H. sapiens and S. cerevisiae (Spearman correlation coefficients of 0.68 and 0.71, respectively) between degree and number of iPfam domain pairs on adjacent edges.",1471-2105-8-259,NaN,NaN,0
"Selenocysteine, the 21st amino acid, is encoded by stop codon UGA, and organisms that use selenocysteine have been found from all three domains of life.",1471-2105-8-225,NaN,NaN,0
"The columns are split according to the proportion of interactions that contain an iPfam domain pair (blue), that contain any other Pfam domains on both proteins (red), and those that contain no Pfam domain pair (yellow).",1471-2105-8-259/X4.53.1,"[(191, 193)]","[191, 210]",1
"They were left to develop at 25 °C and examined as wandering third-instar larvae, pupae, and adults.",PMC1135298,NaN,NaN,0
"Recently, a computational study addressed this question and reported that no tRNA gene for unknown amino acid was found in genome sequences available.",1471-2105-8-225/X1.6.1,"[(74, 76)]","[74, 149]",1
"Indeed, previous studies have reported little or no correlation between the significance measures of various motif finders and measures of accuracy 416.",1471-2105-8-249/X3.123.1,"[(49, 51)]","[49, 63]",1
"Our work also shows that forced expression of the ADGF-A gene can rescue the effects of overactive Toll signaling, suggesting that ADGF-A might function downstream of Toll signaling to control its effects.",PMC1135298,NaN,NaN,0
"By definition, it predicts all proteins in the LR400 dataset at likelihood ratios equal to or above 400 (this is how the LR400 dataset was generated).",1471-2105-8-239,NaN,NaN,0
"Since our prediction method relies only on the conservation patterns of primary sequences, it also provides an opportunity to search novel selenoproteins and other readthrough proteins.",1471-2105-8-225,NaN,NaN,0
"Immunopurified anti-D-mib antibodies (rabbit 541) were used (immunofluorescence, 1:100; Western blot, 1:1,000).",PMC1064853,NaN,NaN,0
One final thought: the dosage compensation machinery in C. elegans acts on the two X chromosomes in the hermaphrodite by twofold down-regulation of gene expression.,PMC138894,NaN,NaN,0
"The predictor that considers the Expression, Orthology, Combined and Transitive modules is the one that achieves the highest accuracy overall.",1471-2105-8-239,NaN,NaN,0
(A) Molecular map of the D-mib locus showing the position of the P-element inserted into the 5? untranslated region (allele D-mib1) and the 13.6 kb deletion that removes the D-mib and the RpS31 genes (allele D-mib2).,PMC1064853,NaN,NaN,0
Protein interactions are thought to be largely mediated by interactions between structural domains.,1471-2105-8-259,NaN,NaN,0
"IAPs (inhibitors of apoptosis) have been shown to block the conversion of pro-caspases into active enzymes, and Reaper, Hid, Grim, and Diablo/Smac prevent IAPs from carrying out this protective function.",PMC138857,NaN,NaN,0
A detailed justification of this approach was given by Carlson et al. 11.,1471-2105-8-249,NaN,NaN,0
"We first assessed the performance of the optimized SCOPE framework on synthetic datasets (for details, see Additional file 1, section S2).",1471-2105-8-249,NaN,NaN,0
"Interestingly, wing margin formation and expression of Cut are not affected by the complete loss of neur activity (Figure 2F and 2F?) [45].",PMC1064853/X5.132.1,"[(63, 66)]","[15, 113]",1
Apterous activates the expression of the Ser and fringe genes in dorsal cells.,PMC1064853,NaN,NaN,0
The inframe stop codons (TAG) are shown in red.,1471-2105-8-225,NaN,NaN,0
"Regardless of the motif model used, a search for all overrepresented motifs of any length and degree of degeneracy leads to a dauntingly large search space.",1471-2105-8-249,NaN,NaN,0
"The x-axis (which is shared with [B]), shows the genotype.",PMC1135298,NaN,NaN,0
"Thus, higher quality datasets can be generated by requiring higher posterior odds ratios.",1471-2105-8-239,NaN,NaN,0
Each empty cell indicates that the corresponding TPase query was not used at the particular stage of PSI-BLAST analysis.,PMC1131882/X6.90.1,"[(65, 68)]","[31, 119]",1
"SCOPE performed well on the synthetic datasets, correctly identifying 92% of planted motifs that are over-represented relative to background (those motifs with a Sig score of greater than 5; Figure 3).",1471-2105-8-249,NaN,NaN,0
"Therefore, unknown clusters in our candidates have possibilities for the 23rd amino acid or novel readthrough proteins.",1471-2105-8-225,NaN,NaN,0
"Moreover, each catalytic residue is a part of a motif that is conserved in the Transib TPases and RAG1 (motifs 4, 6, and 10 in Figures 3 and Figure S3).",PMC1131882,NaN,NaN,0
"(A) Larvae of different genotypes were collected after L2/L3 molt, and the number of puparia was counted at different time points (x-axis: hours after egg laying).",PMC1135298,NaN,NaN,0
"The direct sequence comparison was performed using pmatch, a very fast pairwise alignment algorithm developed by Richard Durbin (unpublished, source code available 34).",1471-2105-8-259,NaN,NaN,0
The first cluster is comprised of c-type cytochromes from δ-proteobacteria Geobacter sulfurreducens and G. metallireducens.,1471-2105-8-225,NaN,NaN,0
"For MotifSampler and wConsensus, the lower part of the range indicates required parameters, while the upper part indicates the total number of parameters, including ""power user"" parameters that the program authors stress should typically be left as default.",1471-2105-8-249,NaN,NaN,0
"Like other DNA transposons, Transib transposons exist as autonomous and nonautonomous elements.",PMC1131882,NaN,NaN,0
"PSLT (Protein Subcellular Localization Tool) subcellular localization predictions 54 were used to classify protein pairs in one of four groups:: pairs of proteins predicted to be in the same compartment, pairs of proteins predicted to be in neighboring compartments (cytosol-nucleus, endoplasmic reticulum-Golgi, Golgi-cytosol, cytosol-plasma membrane, and plasma membrane-secreted), pairs of proteins predicted in different non-neighboring compartments and pairs of proteins for which there were no localization predictions.",1471-2105-8-239/X2.398.1,"[(497, 499)]","[497, 524]",1
This difference may be due to the slightly different constructs used in the experiments and the different assay systems.,PMC138857,NaN,NaN,0
"It is also possible to define Y as the uniform distribution; however, we found that many motifs had non-uniform distributions throughout all upstream regions of the genome, possibly as an artifact of the non-uniform AT/CG distributions in upstream regions 32.",1471-2105-8-249,NaN,NaN,0
"The critical third nucleotide of the hAT 5? termini is always G, as opposed to C in the RSS heptamer.",PMC1131882,NaN,NaN,0
"Conversely, the function of Drosophila mib (D-mib), the homolog of D. rerio mib gene, is not known.",PMC1064853,NaN,NaN,0
"Of the 21 clusters, 15 were known selenoproteins, and four were known pyrrolysine proteins.",1471-2105-8-225,NaN,NaN,0
-CDK2 and MCM4 were predicted to interact at a posterior odds ratio of 62.,1471-2105-8-239,NaN,NaN,0
"Fourth, hAT- and RAG1/2-mediated transpositions differ dramatically in terms of the GC content of their target sites: Unlike Transib transposons and RAG1 transpositions occurring in GC-rich DNA, hAT transposons tend to be integrated into AT-rich regions (Table S2).",PMC1131882,NaN,NaN,0
"The iPfam coverage, shown in blue, is much smaller, ranging from 2.92% in D. melanogaster to 19.02% in H. sapiens.",1471-2105-8-259,NaN,NaN,0
"RAG1_HS, RAG1_PD, RAG1_SS, RAG1_RM, and RAG1_LM mark the human (GenBank accession number NP_000439), lungfish (AAS75810), pig (BAC54968), stripe-sided rhabdornis or Rhabdornis mysticalis bird (AAQ76078), and latimeria (AAS75807) proteins, respectively.",PMC1131882,NaN,NaN,0
"This suggests that the ratio of specific to promiscuous iPfam domain pairs is very similar in S. cerevisiae and H. sapiens, whereas E. coli features fewer multiply reoccurring iPfam domain pairs.",1471-2105-8-259,NaN,NaN,0
3) Predictors based on orthology work on the assumption that the orthologs of a protein pair that are known to interact in one organism will also interact.,1471-2105-8-239,NaN,NaN,0
The probability of covering only 157 complexes is just 6.24 · 10-07.,1471-2105-8-259,NaN,NaN,0
"The ring gland dissected from this larva (C) shows morphology of the normal ring gland before the degenerative changes of prothoracic gland starts (compare to schematic diagram to the left of [C], from [28]).",PMC1135298,NaN,NaN,0
The correlation is outlined by dotted lines.,1471-2105-8-259,NaN,NaN,0
The 38-bp consensus TIR of Transib transposons consists of a conserved 5?- CACAATG heptamer separated by a variable 23-bp spacer from an AAAAAAATC-3? nonamer.,PMC1131882,NaN,NaN,0
The Orthology module contributes to the prediction of only 8474 protein pairs in the LR400 dataset (23%).,1471-2105-8-239,NaN,NaN,0
"RAG1/2-mediated transpositions also show significant target specificity, presumably reflecting the original specificity of the Transib TPase [12].",PMC1131882,NaN,NaN,0
"To test this, we created 1000 random networks per species using the algorithm described in Methods.",1471-2105-8-259,NaN,NaN,0
"In a B and T cell site-specific recombination reaction, commonly known as V(D)J recombination, one V, one D, and one J segment are joined together into a single exon encoding the variable antigen-binding region of the receptor.",PMC1131882,NaN,NaN,0
A protein Dpro_2 contains yet another inframe stop codon (TAG) at the column 189.,1471-2105-8-225,NaN,NaN,0
"(A) Percentage of pupae (blue bars) and adult flies (purple bars) demonstrating the larval and pupal survival, respectively, of the adgf-a mutant flies rescued by expression of transgenic ADGF-A in different tissues.",PMC1135298,NaN,NaN,0
"Reaper, Hid, Grim, and Diablo/Smac can physically interact with IAPs, thereby inhibiting the anti-apoptotic activity of IAPs and allowing caspase activation.",PMC138857,NaN,NaN,0
"If we measure purifying selection for amino acid sequences by the ratio of nonsynonymous to synonymous substitution rates (dN/dS), a protein with a stop-codon-encoded amino acid will indicate the sign of selection, while CNS will not.",1471-2105-8-225/X1.295.1,"[(230, 233)]","[230, 233]",1
"At the same time, we counted the number of iPfam domain pairs on the adjacent edges.",1471-2105-8-259,NaN,NaN,0
"As a consequence, a prior odds ratio of 1/400 was used for all work in the paper, which is similar to the estimate for yeast and is likely still an underestimate of the true value.",1471-2105-8-239,NaN,NaN,0
"In fact, almost 40% of these LR400 interactions achieve a likelihood ratio above 400 from the Orthology module.",1471-2105-8-239,NaN,NaN,0
"In sea anemone, the RAG1 core–like protein is capped by the ring finger motif, which also forms the C-terminus in the RAG1 N-terminal domain.",PMC1131882,NaN,NaN,0
We then calculated the iPfam coverage on the protein interactions in each randomised network.,1471-2105-8-259,NaN,NaN,0
"The working hypothesis is, in effect, that the local maxima are predictable (corresponding to one of three motif classes) and exploitable (we can find the local maxima in each class and choose whichever is higher).",1471-2105-8-249,NaN,NaN,0
"Nevertheless, as larger datasets become available, SCOPE's efficient search strategy makes it an ideal platform for exploring the effect of focused improvements to the motif finding approach described, such as the use of complex objective functions that may better approximate biological significance.",1471-2105-8-249,NaN,NaN,0
It is this predictor that is further analyzed in the next sections.,1471-2105-8-239,NaN,NaN,0
Such selenoproteins identified through our screening of nearly 200 microbial genomes were selenoprotein A and only one uncertain candidate.,1471-2105-8-225,NaN,NaN,0
The Rhodes dataset was trained using an earlier version of the HPRD.,1471-2105-8-239,NaN,NaN,0
"A second constraint associated with a hierarchical ensemble learning method is the multiplicative increase in the number of parameters associated with it, though this problem may be ameliorated by the use of parameter-free algorithms that employ restricted search spaces.",1471-2105-8-249,NaN,NaN,0
"To illustrate the characteristic 5-bp TSDs, we show copies of Transib transposons with intact 5? and 3? TIRs from diverse families of Transib transposons present in the D. melanogaster, D. pseudoobscura, A. gambiae, and S. purpuratus genomes (Figure S4).",PMC1131882,NaN,NaN,0
The ADGF-A promoter contains consensus binding sites for effectors of both Toll and ecdysone signaling.,PMC1135298,NaN,NaN,0
"The following protocol describes the procedure: (1) Use a GenBank set combined with N number of Transib TPases (in our studies, N was equal to 7, 13, and 18), (2) run PSI-BLAST against GenBank combined with TPases using each TPase as a query or seed, (3) select only Transib TPase sequences with E-values less than 10-5 to define the PSSM, (4) take the best E-value (Ei) obtained by PSI-BLAST for RAG1s when PSSM is constructed without RAG1, then (5) repeat these operations for different numbers (N) of TPases.",PMC1131882/X6.320.1,"[(428, 435)]","[428, 440]",1
Red circles mark species in which Transib TPases were found.,PMC1131882,NaN,NaN,0
"Since ADGF-A is strongly expressed in embryonic mesoderm [16], we have tried to rescue the phenotype by the expression of ADGF-A in embryonic and larval muscle cells using the Dmef2-Gal4 driver [25].",PMC1135298,NaN,NaN,0
The specific loss of Ser accumulation into intracellular vesicles (compare [E?] with [B?]) correlated with the elevated levels of Ser seen at the apical cortex of D-mib mutant cells (compare [E] with [B]).,PMC1064853,NaN,NaN,0
"YFP::D-mib localized at the apical cortex and in the cytoplasm (Figure 7C–7 D???), as seen for endogenous D-mib (see Figure 3).",PMC1064853,NaN,NaN,0
"There were 15 families satisfying this criterion, but one family, proline reductase, was excluded because it was found in only one organism in our dataset.",1471-2105-8-225,NaN,NaN,0
"Within this subset of interactions, we nevertheless made several reassuring observations: structural domain pairs are enriched in experimental protein interactions.",1471-2105-8-259,NaN,NaN,0
"In contrast, ventral clones did not prevent the expression of Cut (C and D), implying that D-mib is not strictly required for Dl signaling.",PMC1064853/X5.157.2,"[(32, 35)]","[32, 75]",1
"When three-dimensional structures are available for both proteins thought to interact, high quality predictions and additional information such as the residues involved in the interaction and their binding affinity may be estimated (reviewed in 24).",1471-2105-8-239,NaN,NaN,0
"Since the genome annotation of M. acetivorans describes this protein as a gene containing an inframe amber codon, we classified it as a ''known'' candidate, although it is still unclear whether it really contains pyrrolysine.",1471-2105-8-225,NaN,NaN,0
The table shows that hAT transposons are inserted preferentially into GC-rich sites.,PMC1131882,NaN,NaN,0
"To avoid detection of false similarities caused by simple repeats and coiled coils, the PSI-BLAST search was performed using stringent conditions with the SEG [47] and COILS [48] filters masking all low-complexity regions and coiled coils, respectively; composition-based statistics [45] were also employed.",PMC1131882,NaN,NaN,0
This would be consistent with the role of adenosine as a “stress hormone” in mammals [6].,PMC1135298,NaN,NaN,0
"The Combined module uses domain co-occurrence, post-translational modification (PTM) co-occurrence and subcellular localization information to predict interaction.",1471-2105-8-239,NaN,NaN,0
Each experiment was repeated at least four times (with 20–30 animals in each vial) and the standard error is shown.,PMC1135298,NaN,NaN,0
Nucleotide positions of the RAG1-like sequences are shown beneath the white rectangles.,PMC1131882,NaN,NaN,0
"The three families we failed to find were SelW-like protein, peroxiredoxin and thiol:protein disulphide oxidoreductase.",1471-2105-8-225/X1.121.1,"[(22, 28)]","[22, 36]",1
Neur and Mib proteins completely differ in primary structure.,PMC1064853,NaN,NaN,0
"Furthermore, the critical DDE catalytic triad of RAG1 is shared with the Transib transposase as part of conserved motifs.",PMC1131882,NaN,NaN,0
"Using FGENESH [33], we detected that the RAG1 core–like open reading frame (ORF) in the contig 29068 forms a terminal exon (positions 1154–2947) of an incomplete hypothetical gene composed of two exons (internal and terminal; see Figure S6).",PMC1131882,NaN,NaN,0
BLASTP E-values characterizing similarities between the sea urchin and RAG1 proteins are shown above the white rectangles.,PMC1131882,NaN,NaN,0
"Based on the currently available sequence data, we also reconstructed portions of TPases that were missed in previous studies [17] (Materials and Methods; see Figure S2).",PMC1131882,NaN,NaN,0
"It is possible that using such algorithms to define a collection of background enhancer sequences may improve the performance of SCOPE, as well as that of the other motif finders, on Drosophila.",1471-2105-8-249,NaN,NaN,0
"Building on this intuition, one can argue that the characters """"A"""" and """"not-A"""" (IUPAC character """"B"")"" are roughly equivalent, while """"A or G"""" (IUPAC character """"R"")"" is different from """"A"""" as there are six ways to define a combination of two bases, while only four ways to define a combination of one base or three bases.",1471-2105-8-249,NaN,NaN,0
Interologs have been used to predict protein-protein interactions in human 36.,1471-2105-8-239,NaN,NaN,0
"The ADGF-A gene contains four exons and two transcriptional starts [17,47].",PMC1135298,NaN,NaN,0
The annotations of PTMs in human proteins were downloaded from UniProt 76 and HPRD 15.,1471-2105-8-239,NaN,NaN,0
"In one study, Liquid facet was proposed to target Dl to an endocytic recycling compartment, suggesting that recycling of Dl may be required for signaling.",PMC1064853,NaN,NaN,0
"Instead, this behaviour simulates a network with a high false positive rate.",1471-2105-8-259,NaN,NaN,0
"Conversely, the PWM-based methods have an apparently more powerful motif model 17, but their search strategies cannot guarantee optimality and often terminate at local optima.",1471-2105-8-249/X3.219.1,"[(111, 117)]","[111, 138]",1
We conclude that ectopic expression of Neur compensates for the loss of D-mib activity.,PMC1064853,NaN,NaN,0
"When equal numbers of positives and negatives are used in training, the diversity that exists in the non-interacting protein pair space may not be captured, thus resulting in misleading likelihood ratios for the predictive modules.",1471-2105-8-239/X2.186.2,"[(140, 143)]","[68, 155]",1
"The site specificity of the recombination is defined by the binding of RAG1/2 to RSSs flanking the V, D, and J segments [4].",PMC1131882,NaN,NaN,0
"Of the four pyrrolysine proteins detected, three methylamine methyltransferases have been experimentally confirmed to contain pyrrolysine 617.",1471-2105-8-225,NaN,NaN,0
Selenoprotein families we failed to detect because of nonconserved location of stop codons.,1471-2105-8-225/X1.133.1,"[(26, 32)]","[0, 42]",1
"Genetically, this Drosophila Bcl-2 family member appears to function upstream of, or in parallel to, the Drosophila ced-4/apaf-1 homolog and downstream of, or in parallel to, the Drosophila regulators of apoptosis, reaper, hid, and grim [22].",PMC138857,NaN,NaN,0
