sentence,sentence_id,cue_span,scope_span,target
This superfamily was discovered recently based on computational analysis of the fruit fly and African malaria mosquito genomes.,PMC1131882,NaN,NaN,0
"However, the Disorder module does not contribute significantly to the prediction as predictors that consider it do not, in general, do better than their counterparts that do not use it.",1471-2105-8-239/X2.158.2,"[(115, 118)]","[115, 184]",1
"Although many of the currently known selenoproteins and pyrrolysine proteins were successfully detected, no candidate for the 23rd amino acid was discovered.",1471-2105-8-225/X1.260.1,"[(105, 107)]","[105, 156]",1
The boxed areas in (A) and (D) are shown at higher magnification in (B–F?).,PMC1064853,NaN,NaN,0
"Additionally, N mediates inductive signaling between cells with distinct identities.",PMC1064853,NaN,NaN,0
"However, cells expressing high levels of YFP::D-mib showed a strong reduction in the level of both Dl and Ser at the cortex (Figure 7C–7C???)''', further indicating that D-mib down-regulates the levels of both Ser and Dl at the apical cortex (E. C. Lai, F. Roegiers, X. Qin, R. Le Borgne, F. Schweisguth, et al., unpublished data).",PMC1064853,NaN,NaN,0
"The lack of specificity might be attributed to a number of reasons, such as the absence of other MSL components, the presence of other RNAs interacting with MOF, or worse, it might reflect a property of MOF without functional significance: that is, MOF might not contact RNA at all in vivo.",PMC138894/X9.72.5,"[(80, 87)]","[80, 111]",1
The D-mib3 mutant allele is predicted to produce a truncated protein devoid of E3 ubiquitin ligase activity whereas the D-mib4 protein carries a mutation at a conserved position in the second Mib repeat.,PMC1064853,NaN,NaN,0
"Of course, SCOPE's learning rule is extremely simple, and more complex learning rules may allow SCOPE to approach its theoretical upper bound.",1471-2105-8-249,NaN,NaN,0
(a) Average and standard error of sensitivity and PPV for each program on all 78 regulons.,1471-2105-8-249,NaN,NaN,0
The legend under the sequence show the names of transcription factors binding to matching colored binding sites.,PMC1135298,NaN,NaN,0
"In mammals, dosage compensation also occurs in the homogametic sex (the female) by X inactivation, whereby an entire X chromosome forms a distinct, heterochromatic, transcriptionally inactive nuclear structure known as the Barr body.",PMC138894,NaN,NaN,0
The matrix in Table 2 shows the pair-wise conservation of iPfam domain pairs.,1471-2105-8-259,NaN,NaN,0
"All of these phenotypes are strikingly similar to the abnormalities seen in adgf-a mutants, which was our first clue as to a possible interaction of ADGF-A with the Toll signaling pathway.",PMC1135298,NaN,NaN,0
Each of SCOPE's three component algorithms seeks to maximize the same objective function over a different class of motifs.,1471-2105-8-249,NaN,NaN,0
"We reasoned that if there are iPfam domain pairs that act as reusable modules in protein interactions, then highly connected proteins should also be more likely to contain promiscuous iPfam domain pairs and vice-versa.",1471-2105-8-259,NaN,NaN,0
"The Orthology and Combined modules both have states that achieve likelihood ratios above 400 (as high as 1207 for the Orthology module and 613 for the Combined module), indicating that both these modules can, on their own, predict some interacting protein pairs with a posterior odds ratio above 1.",1471-2105-8-239,NaN,NaN,0
The randomly-generated negative dataset used for the training and testing of the predictor was created by selecting protein pairs at random from the Informative Protein Set.,1471-2105-8-239,NaN,NaN,0
"In contrast, the average posterior odds ratio of our LR400 dataset is above 700.",1471-2105-8-239,NaN,NaN,0
"To ensure that a conservation profile for the Transib TPases and RAG1 proteins was not produced by a systematic error, we employed a procedure of “step-wise” PSI-BLAST iterations.",PMC1131882/X6.318.1,"[(83, 86)]","[15, 117]",1
The ultimate goal of a motif finder is to identify the specific subsequences Û in U that act as binding sites for the transcription factor(s) that regulate G.,1471-2105-8-249,NaN,NaN,0
"Therefore, if such an amino acid exists, it will have limited distribution in the tree of life.",1471-2105-8-225,NaN,NaN,0
"The antigens can be identified after they are specifically bound by surface receptors of vertebrate B and T immune cells (BCRs and TCRs, respectively).",PMC1131882,NaN,NaN,0
"HesB family was not clustered into one family, because their sequences were too short and diverged.",1471-2105-8-225/X1.131.1,"[(16, 19)]","[0, 45]",1
"We produced mutations in five of the six ADGF genes by homologous recombination mutagenesis [17] and showed that loss of the most abundantly expressed gene, ADGF-A, leads to death in the larval or pupal stage.",PMC1135298,NaN,NaN,0
This indicates that a key function of Neur in the embryo cannot be provided by D-mib.,PMC1064853/X5.253.1,"[(57, 63)]","[20, 84]",1
"Then, 2Δl = 2(lfree – lfix) approximately follows the χ2 distribution with one degree of freedom.",1471-2105-8-225,NaN,NaN,0
"Interestingly, the 6,690-bp contig 6797 harbours two additional defective pseudogenes coding for different RAG1 core–like proteins (Figure 5).",PMC1131882,NaN,NaN,0
"At this stage, the Hml marker disappeared from the most of the hemocytes in mutants (see Figure 4F and 4G).",PMC1135298,NaN,NaN,0
We conclude that D-mib and Neur are two structurally distinct proteins that have similar molecular activities but distinct developmental functions in Drosophila.,PMC1064853,NaN,NaN,0
"The direct transfer of interactions to human from either yeast, fly or worm does not alone result in a posterior odds ratio above 1 (as the likelihood ratios of interaction for all yeast, fly and worm bins in the Orthology module are below 400).",1471-2105-8-239,NaN,NaN,0
"Three UAS-D-mib transgenic lines were tested, and none showed detectable rescue whereas the two UAS-neur lines used as positive controls either fully or partially rescued the cuticular neurogenic phenotype of neurPGAL4/neur1F65 embryos (data not shown; UAS-D-mib+/+, neurPGAL4+/+ embryos developed normally).",PMC1064853/X5.252.4,"[(50, 54)]","[50, 79]",1
"The main proposition of this model is that roX2 can interact with both MLE and MOF, and perhaps even other MSL proteins, as both roX RNAs are certainly large enough to accommodate binding sites for several proteins [6].",PMC138894,NaN,NaN,0
"Thus, an essential function of D-mib in the wing is to regulate the endocytosis of Ser in dorsal cells to non-autonomously promote the activation of N along the D-V boundary.",PMC1064853,NaN,NaN,0
This is supported by the presence of multiple sites for ecdysone-inducible transcription regulators in the ADGF-A promoter (Figure 9).,PMC1135298,NaN,NaN,0
χS The number of iPfam domain pairs observed in species S,1471-2105-8-259,NaN,NaN,0
"Coloring scheme [43] reflects physiochemical properties of amino acids: black shading marks hydrophobic residues, blue indicates charged (white font), positively charged (red font), and negatively charged (green font); red indicates proline (blue font) and glycine (green font); gray indicates aliphatic (red font) and aromatic (blue font); green indicates polar (black font) and amphoteric (red font); and yellow indicates tiny (blue font) and small (green font).",PMC1131882,NaN,NaN,0
"First, as we mentioned previously, there is no significant sequence identity between hAT TPases and RAG1, even if one employs a PSI-BLAST search with most relaxed parameters (i.e., E < 10, no filters, no composition-based statistics).",PMC1131882/X6.279.2,"[(189, 191)]","[189, 199]",1
"A comparison to other large human interaction datasets revealed the average false positive rate of our dataset to be 76%, which is much lower than the overall average for most large scale, currently available, human interaction datasets (experimental and computational) estimated to be 90% 18.",1471-2105-8-239,NaN,NaN,0
"Additionally, the ectopic expression of Dl can partially rescue the Ser wing phenotype [14].",PMC1064853,NaN,NaN,0
This observation could be leveraged by a search algorithm that explicitly searches for motifs matching this unique structure.,1471-2105-8-249,NaN,NaN,0
"The adenosine concentration in the adgf-a mutant was 1.14 ± 0.26 ?M compared to less than 0.08 ?M in the wild type, and the deoxyadenosine concentration in mutants was 1.66 ± 0.99 ?M compared to an undetectable level in the wild type.",PMC1135298,NaN,NaN,0
The power law distribution of iPfam frequencies implies that the majority of covered protein interactions can be attributed to a minority of iPfam domain pairs.,1471-2105-8-259,NaN,NaN,0
The estimated total number of iPfam domains in all species,1471-2105-8-259,NaN,NaN,0
"The more diverse the TPases used in determining the PSSM, the more accurate is the approximation; some of the insect Transib TPases are less than 30% identical to each other, as shown in Figure 2.",PMC1131882,NaN,NaN,0
"The observed alignment was fitted to two distinct substitution models, one of which estimates dN/dS from the data, and the other fixes it to 1.0.",1471-2105-8-225,NaN,NaN,0
It was shown that certain cellular IAPs can be degraded in a proteasome-dependent manner prior to thymocyte apoptosis.,PMC138857,NaN,NaN,0
"In addition, domains that exist as separate proteins in some genomes but are also seen fused in a single protein in other genomes have been used to suggest the isolated domains may interact 3132.",1471-2105-8-239,NaN,NaN,0
This idea is supported by our finding that both pupariation rate and survival of the adgf-a mutant can also be improved by feeding the mutant larvae with 20E in the diet (see Figure 7A).,PMC1135298,NaN,NaN,0
The right-hand portion of Table 3 shows the accuracy measures for the highest scoring subset of predictors that consider the Transitive module.,1471-2105-8-239,NaN,NaN,0
They found that roX1 and roX2 RNAs are associated with the X chromosome at different stages and sites during the assembly of the DCC.,PMC138894,NaN,NaN,0
"Expression of Ser in dorsal cells did not rescue the D-mib2/D-mib3 wing pouch mutant phenotype (compare [B] with [A]), consistent with D-mib being required for Ser signaling.",PMC1064853/X5.238.1,"[(38, 41)]","[38, 94]",1
Estimates for the prior odds ratio of interaction vary.,1471-2105-8-239,NaN,NaN,0
Samples of the protein pair space were taken instead of considering the whole space as this was more computationally tractable.,1471-2105-8-239/X2.442.1,"[(45, 55)]","[45, 83]",1
51.7% of the iPfam domain pairs in S. cerevisiae and 45.3% in H. sapiens are seen in just one experimental interaction.,1471-2105-8-259,NaN,NaN,0
"Wild-type cDNA for ADGF-A was amplified by PCR using proofreading DNA polymerase (ProofStart; Invitrogen, Carlsbad, California, United States) from a pOT2 vector containing the ADGF-A EST-clone (GH08276) using the following primers: 5?- CGTCTAGAATGTCGCCAGTCATCCGCC-3? (5? end primer with XbaI tail) and 5?- GCTGATCATCAATCGATCCGTTGACTGGGGGA-3? (3? end primer with BclI tail).",PMC1135298,NaN,NaN,0
"Later, this model was expanded by the suggestion that both RAG1 and RAG2 might have evolved from a transposase (TPase) that catalyzed transpositions of ancient transposons flanked by TIRs that were precursors of RSSs [9].",PMC1131882,NaN,NaN,0
"In addition, Reaper, Hid and Grim are able to induce apoptosis in heterologous systems, suggesting that vertebrate homologs of these proteins exist (reviewed in [26]).",PMC138857,NaN,NaN,0
"In order to eliminate pseudogenes and sequencing errors, conservation of iORFs and their inframe stop codons was examined.",1471-2105-8-225,NaN,NaN,0
"Interestingly, immunoprecipitation assays using extracts from SL-2 cells transfected with wild-type or mutant mof genes indicated that the chromodomain is essential for the specific interaction between MOF and roX2, but that the amino-terminal region and HAT domain were not essential for this interaction.",PMC138894/X9.48.1,"[(271, 274)]","[271, 305]",1
"Therefore, we asked whether the observed iPfam coverage is larger than would be expected by chance.",1471-2105-8-259,NaN,NaN,0
"A similar process of hemocyte differentiation and release from the lymph glands normally takes place at the onset of metamorphosis, when pupal macrophages remove histolyzing tissues.",PMC1135298,NaN,NaN,0
Preliminary A. aegypti sequence data were obtained from The Institute for Genomic Research through the Web site at http://www.tigr.org on 4 March 2004.,PMC1131882,NaN,NaN,0
"We conclude that the activity of the D-mib gene is required for the specification of the wing margin and, hence, growth of the wing pouch.",PMC1064853,NaN,NaN,0
"Our results support the concept of domain interactions as reusable, conserved building blocks of protein interactions, but also highlight the limitations currently imposed by the small number of available protein structures.",1471-2105-8-259,NaN,NaN,0
"However, we cannot exclude the role of elevated deoxyadenosine in these effects.",PMC1135298,NaN,NaN,0
Signaling by the Notch ligands Delta (Dl) and Serrate (Ser) regulates a wide variety of essential cell-fate decisions during animal development.,PMC1064853,NaN,NaN,0
The PSSM is a weight matrix indicating the relative occurrence of each of the 20 aa at each position in the alignment.,PMC1131882,NaN,NaN,0
"As such, all combinations of the Group A modules can be used to predict interaction in the presence or absence of the Transitive module.",1471-2105-8-239/X2.72.1,"[(103, 110)]","[103, 135]",1
"This posterior odds ratio can be re-written using Bayes rule: Opost = P(I|f1,..., fn)P(~I|f1,..., fn)=P(f1,..., fn|I)∗P(I)P(f1,..., fn)P(f1,..., fn|~I)∗P(~I)P(f1,..., fn)=P(f1,..., fn|I)∗P(I)P(f,..., fn|~I∗P(~I)=P(I)P(~I∗P(f1,..., fn|I)P(f1,..., fn|~I)=Oprior∗LR(1,...,fn) where I is a binary variable representing interaction, ~I represents non-interaction, f1 through fn are the features we are considering, Oprior is the prior odds ratio and LR is the likelihood ratio.",1471-2105-8-239,NaN,NaN,0
"At least, only one experimentally-confirmed example from a pathogenic strain of Escherichia coli 23, whose genome is not yet determined, does not obey this rule.",1471-2105-8-225/X1.255.2,"[(117, 120)]","[101, 135]",1
The corresponding positions are perfectly conserved in all Transib transposons (Figure 4A and 4B; excluding the 85% conserved position 34 in the Transib consensus that corresponds to position 5 in the RSS nonamer).,PMC1131882,NaN,NaN,0
"This indication of precocious metamorphic changes [36] in the mutant is further supported by the finding that hemocytes aggregate in a segmental pattern in early rather than late third instar (see Figure 4H–4J), and that the hemocytes lose expression of Hemolectin in late third-instar larvae rather than at the onset of metamorphosis (see Figure 4G) [21].",PMC1135298/X7.219.2,"[(162, 173)]","[162, 178]",1
"Again, Ei-values of matches between RAG1s and the new PSSM derived from multiple alignment of 15 Transib TPases (the two GenBank proteins plus all our TPases) were much smaller (approximately 10-6–10-3; Table 1) than those obtained based on the PSSM constructed from the nine TPases at the preceding step (approximately 10-3–10-2).",PMC1131882,NaN,NaN,0
"Each bar shows the number of all circulating hemocytes, and the gray part of the bars represent the lamellocyte population.",PMC1135298,NaN,NaN,0
"The C. elegans genome sequence was completed two years ago [1], and both the Drosophila [2] and human genomes are essentially completely sequenced at this point.",PMC138857,NaN,NaN,0
"While the eukaryotes share 524 domain pairs, only 158 iPfam domain pairs are shared between S. cerevisiae and E. coli, and only 135 between E. coli and H. sapiens.",1471-2105-8-259,NaN,NaN,0
"In contrast, if the iORF consists of two adjacent genes, many hits that do not cover the inframe stop codon will be found.",1471-2105-8-225/X1.65.1,"[(75, 78)]","[75, 107]",1
Defining N for degenerate or bipartite motifs raises a significant conceptual challenge.,1471-2105-8-249,NaN,NaN,0
"It may be encoded by a separate exon that is difficult to detect given its short length and the high level of sequence divergence between these species and vertebrates, or it might have been added in vertebrates.",PMC1131882,NaN,NaN,0
"While this objective function prevents a single upstream region from dominating a motif's score, it fails to account for multiple instances of a binding site in a single gene that may arise due to cooperative binding.",1471-2105-8-249/X3.307.2,"[(100, 105)]","[100, 216]",1
This underlines that a few promiscuous iPfam domain pairs are responsible for the majority of the iPfam coverage.,1471-2105-8-259,NaN,NaN,0
"An average of ≈ 16% of interaction entries were lost in the mapping process, either if no sequence was provided with the original entry or if no significant matching sequence could be found in Integr8.",1471-2105-8-259/X4.262.2,"[(87, 89)]","[87, 135]",1
Transcription factors often require their binding sites to be located in a restricted range relative to the start of transcription.,1471-2105-8-249,NaN,NaN,0
"When all 18 TPases were combined with the original GenBank set, the Ei values of matches between RAG1s and the Transib PSSM dropped significantly further (10-9–10-4; Table 1).",PMC1131882,NaN,NaN,0
"In agreement with the immunoprecipitation results, they found that an intact chromodomain is essential for RNA binding, whereas the amino terminus or the HAT domain of MOF was not essential.",PMC138894,NaN,NaN,0
The consensus sequence is shown in the top line.,PMC1131882,NaN,NaN,0
"In particular, gene pairs within an operon are problematic because their gene arrangement is often conserved.",1471-2105-8-225,NaN,NaN,0
"If D-mib is required for Ser signaling during wing development, then loss of D-mib activity in dorsal cells should affect the specification of the wing margin in a non-autonomous manner.",PMC1064853,NaN,NaN,0
"These results demonstrate that the target tissues of adgf-a mutants are normally responsive to ecdysteroids and that they are probably capable of releasing ecdysteroids, although the level of ecdysteroids might vary.?>",PMC1135298,NaN,NaN,0
A stock carrying the ubiquitous actin-Gal4 driver (P-actin-Gal4 UAS-GFP/CyO; lethal insertion on Chromosome II) was obtained from Dr. R. Sousa.,PMC1135298,NaN,NaN,0
Asterisks denote stop codons in the corresponding RAG1-like sequences.,PMC1131882,NaN,NaN,0
"Even more, half of the covered experimental interactions in H. sapiens contain an iPfam domain pair that occurs in more than 16 different experimental interactions (5 for S. cerevisiae).",1471-2105-8-259,NaN,NaN,0
"In fact, we find a two-fold enrichment for iPfam domain pairs in the complexes described by Gavin et al. 29.",1471-2105-8-259,NaN,NaN,0
"Since the new method scores and ranks all human protein pairs, smaller subsets of higher quality can be generated thus leading to even lower false positive prediction rates.",1471-2105-8-239,NaN,NaN,0
"Analogously, the 15-bp insertion sites were composed of two 10-bp flanking fragm.",PMC1131882,NaN,NaN,0
"In addition, while C. elegans has two BIR-domain-containing proteins, neither appears to regulate cell death: BIR-1 has been demonstrated to be essential for cytokinesis instead [39].",PMC138857/X8.106.1,"[(70, 77)]","[70, 108]",1
"(F and G) Differential interference contrast and fluorescent microscopy (merged image) of living circulating hemocytes stained by the Hml-GFP marker (magnification 100×; scale bar, 10 ?m).",PMC1135298,NaN,NaN,0
The probability of seeing m at least C(m) times in the regulon can be approximated by the Poisson distribution: p(m) = ∑k≥C(m) [(λke-λ)/k! ] where λ is the expectation of C(m) with respect to the null motif distribution and the number of positions in the regulon.,1471-2105-8-249,NaN,NaN,0
"As the number of completely sequenced genomes increases, several research groups started to predict proteins that contain stop-codon-encoded amino acids through computational analyses.",1471-2105-8-225,NaN,NaN,0
"Nevertheless, our observation that D-mib could not compensate for the loss of neur activity in the embryo indicates that D-mib and Neur have overlapping rather than identical molecular activities.",PMC1064853/X5.299.3,"[(41, 50)]","[41, 105]",1
This is because the residues near the inframe stop codons are poorly conserved.,1471-2105-8-225,NaN,NaN,0
"More precisely, the training step consisted of calculating the respective proportions of positive and negative examples that fall into each bin of the feature(s) considered (i.e. that have a particular state).",1471-2105-8-239,NaN,NaN,0
"Both genes have been conserved from flies to mammals [18,19,33,34].",PMC1064853,NaN,NaN,0
"Since the choice of negative training data may influence the method, the choice of different training sets in the context of the probabilistic predictor presented here was investigated to determine which type of training set offers the highest accuracy.",1471-2105-8-239,NaN,NaN,0
In total we found 617 pairs of proteins that contained an iPfam domain pair.,1471-2105-8-259,NaN,NaN,0
The clusters predicted by our method are summarized in Table 1.,1471-2105-8-225,NaN,NaN,0
"Consistent with this possibility, D-mib is uniformly distributed in imaginal discs, whereas Neur is specifically detected in sensory cells [52].",PMC1064853,NaN,NaN,0
"By enumerating ORFs that have an inframe stop codon from genomes and examining their evolutionary conservation, candidate proteins can be predicted.",1471-2105-8-225,NaN,NaN,0
"Alternatively, the N-terminal domain of RAG1 might have been derived from a separate, unknown transposon.",PMC1131882,NaN,NaN,0
"For each organism, its iORFs were extracted from the pre-filtering clusters, and codon usage at the inframe stop positions was counted.",1471-2105-8-225,NaN,NaN,0
"The lack of specificity might be attributed to a number of reasons, such as the absence of other MSL components, the presence of other RNAs interacting with MOF, or worse, it might reflect a property of MOF without functional significance: that is, MOF might not contact RNA at all in vivo.",PMC138894/X9.72.6,"[(4, 8)]","[4, 160]",1
Names of these elements are shown above the rectangles.,PMC1131882,NaN,NaN,0
A complete loss of Cut and Wg accumulation and wg-lacZ expression was observed in the central region of third instar D-mib mutant wing discs (data not shown).,PMC1064853/X5.129.1,"[(147, 150)]","[141, 157]",1
"Only seven organisms had statistically significant discrepancies (P < 0.05), and all of them are known to utilize selenocysteine or pyrrolysine.",1471-2105-8-225,NaN,NaN,0
"It reveals that certain iPfam domains such as SH2, SH3_1 or Pkinase_tyr frequently occur in the same architecture.",1471-2105-8-259,NaN,NaN,0
"An average of 7% of hemocytes in the adgf-a mutant are lamellocytes (Figures 3 and 4E), large flat cells that are not present in circulation of wild-type larvae under normal conditions [19].",PMC1135298/X7.77.1,"[(114, 117)]","[114, 184]",1
The matrix elements were subsequently normalized to the number of alignments N.,1471-2105-8-225,NaN,NaN,0
"Several of the programs contributing to the performance comparison were run with different parameter settings for each regulon, and in some cases, motifs were hand filtered as a post-processing step.",1471-2105-8-249,NaN,NaN,0
"However, one can argue that localization-derived negatives might not be able to capture the full diversity of the non-interacting protein space since many proteins in the same cellular compartment do not interact.",1471-2105-8-239/X2.197.2,"[(65, 68)]","[65, 143]",1
"Similar to their approach, we make a linear estimation with the following factors:",1471-2105-8-259,NaN,NaN,0
Our method can reassess this assumption in a SECIS-independent way.,1471-2105-8-225,NaN,NaN,0
ΨS The proteome size for species S,1471-2105-8-259,NaN,NaN,0
"Of course, based on the No Free Lunch Theorem, SCOPE's performance averaged over all theoretically possible datasets will still converge to that of the other motif finding approaches (including random guessing).",1471-2105-8-249,NaN,NaN,0
"Like Apaf-1 and CED-4, loss of function mutations in dark/hac-1/dapaf-1 result in a reduction in developmental programmed cell death.",PMC138857,NaN,NaN,0
"A separate analysis of the assembled sea urchin sequences yielded seven sequences encoding three diverse proteins that were significantly similar to the 380-aa N-terminal domain of RAG1 (BLASTX, E < 10-4), excluding the 100-aa N-terminus (Figure 6).",PMC1131882,NaN,NaN,0
"In a small set of protein structures from S. cerevisiae, it has been shown that interacting domain pairs are more conserved than non-interacting domain pairs 10.",1471-2105-8-259,NaN,NaN,0
(A–F?) Distribution of Dl (green) and Ser (red) in the notum region of wild-type (A–C?) and D-mib1 mutant (D–F?) wing imaginal discs.,PMC1064853,NaN,NaN,0
It does this by considering the local topology of the network predicted by the integration of the Group A modules as depicted in Figure 2.,1471-2105-8-239,NaN,NaN,0
These arguments can now be put to rest.,PMC1131882,NaN,NaN,0
The endogenous D-mib protein (predicted size: 130 kDa) was detected in S2 cells (lane 2) and in imaginal discs from wild-type larvae (lane 3) but was not detectable in homozygous D-mib1 (lane 4) and D-mib1/D-mib3 (lane 5) third instar larvae.,PMC1064853/X5.86.1,"[(150, 153)]","[150, 241]",1
"Although the raw output of the search for evolutionarily conserved iORFs was 273 clusters, most of them were discarded at the subsequent filtering stage.",1471-2105-8-225,NaN,NaN,0
